{
  "kicker": "핵심 축",
  "title": "플랫폼을 떠받치는 네 축",
  "cards": [
    {
      "label": "공간 분리",
      "desc": "개인 시험 작성과 조직 공식 보고를 가른다",
      "badge": "기반"
    },
    {
      "label": "Live Mount",
      "desc": "사본 없이 여러 게시판에 동시 노출한다",
      "badge": "핵심",
      "tone": "positive"
    },
    {
      "label": "정기 취합",
      "desc": "주간·본부 종합보고를 반복 노동에서 뺀다"
    },
    {
      "label": "권한 · 잠금",
      "desc": "보직장 편집권과 작성자 잠금을 분리한다",
      "badge": "쟁점",
      "tone": "caution"
    }
  ],
  "note": {
    "pre": "네 축은 모두 ",
    "strong": "한 보고서",
    "post": " 위에서 작동한다"
  }
}
